size_charge,size_pay,lat,lon,charge,pay,AcquiredInfect,AcquiredConditions,PatientSafetySummary,name
5.80,2.16,31.21673,-85.36307,21175.81,4678.44,0.50,0.51,0.21,SOUTHEAST ALABAMA MEDICAL CENTER
3.27,2.20,34.22148,-86.15966,9719.17,4863.75,0.50,0.91,0.54,MARSHALL MEDICAL CENTER SOUTH
4.88,2.10,34.80175,-87.67514,17021.54,4434.57,0.50,0.65,0.03,ELIZA COFFEE MEMORIAL HOSPITAL
4.63,2.27,33.59616,-86.66750,15875.50,5176.07,0.67,0.79,0.01,ST VINCENT'S EAST
4.10,2.05,34.43845,-85.75574,13485.75,4222.33,0.00,0.00,0.00,DEKALB REGIONAL MEDICAL CENTER
5.33,2.31,33.25607,-86.81035,19038.28,5379.67,0.83,0.70,0.64,SHELBY BAPTIST MEDICAL CENTER
3.42,2.13,34.74649,-87.69895,10415.45,4555.50,0.50,0.91,0.33,HELEN KELLER MEMORIAL HOSPITAL
4.52,2.35,32.32785,-86.27750,15398.35,5554.06,0.50,0.68,0.54,BAPTIST MEDICAL CENTER SOUTH
5.38,2.27,32.36656,-86.28572,19273.23,5185.66,0.50,0.69,0.83,JACKSON HOSPITAL & CLINIC INC
2.64,2.21,32.82377,-85.17019,6870.57,4919.07,0.00,0.00,0.00,GEORGE H. LANIER MEMORIAL HOSPITAL
2.63,2.14,32.63806,-85.40413,6841.94,4628.65,0.50,0.80,0.14,EAST ALABAMA MEDICAL CENTER AND SNF
5.52,2.50,33.50619,-86.80210,19911.35,6237.30,0.67,0.45,0.11,UNIVERSITY OF ALABAMA HOSPITAL
3.64,2.11,34.20768,-86.87489,11409.94,4482.75,0.50,0.64,0.80,CULLMAN REGIONAL MEDICAL CENTER
5.19,2.05,33.66767,-85.83420,18423.95,4220.79,0.00,0.00,0.00,STRINGFELLOW MEMORIAL HOSPITAL
6.20,2.29,34.72007,-86.58108,22960.15,5296.15,0.50,0.65,0.45,HUNTSVILLE HOSPITAL
11.57,2.06,34.00941,-85.97078,47267.06,4254.94,0.67,0.68,0.28,GADSDEN REGIONAL MEDICAL CENTER
7.81,2.06,34.00426,-86.00339,30251.89,4254.39,0.75,0.81,0.91,RIVERVIEW REGIONAL MEDICAL CENTER
6.48,2.15,34.57705,-87.01588,24239.15,4663.23,0.00,0.00,0.00,PARKWAY MEDICAL CENTER
7.01,2.09,31.23767,-85.45625,26661.55,4369.73,0.50,0.55,0.80,FLOWERS HOSPITAL
3.88,2.08,33.50734,-86.78958,12493.96,4333.15,0.50,0.72,0.21,ST VINCENT'S BIRMINGHAM
3.24,2.19,34.66171,-86.04665,9579.67,4836.92,0.00,0.00,0.00,HIGHLANDS MEDICAL CENTER
2.20,2.09,32.94573,-85.98570,4876.91,4393.18,0.50,0.71,0.05,RUSSELL HOSPITAL
4.74,2.06,33.65640,-85.82284,16385.35,4260.15,0.50,0.60,0.05,NORTHEAST ALABAMA REGIONAL MED CENTER
7.68,2.07,30.42700,-87.68386,29683.64,4307.64,0.50,0.95,0.25,SOUTH BALDWIN REGIONAL MEDICAL CENTER
2.47,2.12,34.59052,-86.97262,6116.28,4523.83,0.50,0.78,0.54,DECATUR GENERAL HOSPITAL
4.52,2.15,33.83218,-87.30385,15360.60,4632.20,0.50,0.79,0.96,WALKER BAPTIST MEDICAL CENTER
4.18,2.07,30.68199,-88.19897,13834.85,4283.70,0.83,0.86,0.01,PROVIDENCE HOSPITAL
5.07,2.23,33.20521,-87.52546,17854.04,5033.39,0.67,0.66,0.21,D C H REGIONAL MEDICAL CENTER
5.59,2.00,30.51916,-87.88842,20213.85,3975.50,0.50,0.90,0.17,THOMAS HOSPITAL
4.48,2.31,33.44033,-86.09023,15215.76,5360.00,0.00,0.00,0.00,CITIZENS BAPTIST MEDICAL CENTER
7.88,2.19,33.49854,-86.84633,30587.58,4847.65,0.67,0.70,0.08,BAPTIST MEDICAL CENTER-PRINCETON
2.76,2.07,32.43516,-88.32614,7414.33,4309.42,0.00,0.00,0.00,BRYAN W WHITFIELD MEM HOSP INC
4.62,2.25,30.69697,-88.08081,15837.92,5096.46,0.67,0.55,0.25,MOBILE INFIRMARY
5.36,2.31,33.37328,-86.99163,19198.81,5358.62,0.50,0.68,0.07,MEDICAL WEST AN AFFILIATE OF UAB HEALTH SYSTEM
4.71,2.39,32.43020,-87.05515,16237.06,5718.25,0.50,0.91,0.32,VAUGHAN REG MED CENTER PARKWAY CAMPUS
9.49,2.10,34.69279,-86.57179,37862.53,4423.53,0.50,0.78,0.33,CRESTWOOD MEDICAL CENTER
14.16,2.12,33.46420,-86.77409,59003.04,4504.82,0.50,0.65,0.30,BROOKWOOD MEDICAL CENTER
4.13,2.01,30.68546,-88.13170,13627.25,4031.17,0.50,0.81,0.07,SPRINGHILL MEDICAL CENTER
4.43,2.23,32.38797,-86.17576,14963.24,5011.38,0.50,0.53,0.91,BAPTIST MEDICAL CENTER EAST
4.62,2.22,31.82882,-86.64618,15849.33,4969.92,0.00,0.00,0.00,L V STABLER MEMORIAL HOSPITAL
5.14,2.21,33.16547,-86.25380,18175.83,4947.50,0.00,0.00,0.00,COOSA VALLEY MEDICAL CENTER
5.93,2.69,60.94901,-149.17033,21772.22,7113.33,0.50,0.81,0.91,PROVIDENCE ALASKA MEDICAL CENTER
5.60,2.98,61.56297,-149.25782,20287.07,8411.71,0.00,0.00,0.00,MAT-SU REGIONAL MEDICAL CENTER
5.06,2.57,33.46514,-112.05797,17828.15,6555.23,0.50,0.49,0.70,BANNER GOOD SAMARITAN MEDICAL CENTER
4.90,2.31,32.22734,-111.00065,17079.20,5376.67,0.33,0.75,0.64,CARONDELET ST  MARYS HOSPITAL
5.39,2.22,32.22685,-110.85520,19324.67,4982.07,0.67,0.55,0.21,CARONDELET ST JOSEPHS HOSPITAL
5.74,2.41,34.56017,-112.48217,20901.42,5831.89,0.25,0.68,0.17,YAVAPAI REGIONAL MEDICAL CENTER
4.72,2.36,32.68274,-114.63506,16276.45,5592.18,0.50,0.64,0.70,YUMA REGIONAL MEDICAL CENTER
5.44,2.39,32.88123,-111.71067,19543.64,5720.91,0.50,0.81,0.11,CASA GRANDE REGIONAL MEDICAL CENTER
8.08,3.06,35.20923,-111.64486,31496.08,8770.62,0.67,0.79,0.89,FLAGSTAFF MEDICAL CENTER
6.96,2.68,33.48073,-112.07948,26426.93,7036.79,0.33,0.53,0.11,ST JOSEPH'S HOSPITAL AND MEDICAL CENTER
5.50,2.50,33.52511,-112.10189,19826.81,6245.62,0.50,0.71,0.57,PHOENIX BAPTIST HOSPITAL
7.60,2.31,33.29750,-111.87461,29315.58,5398.79,0.50,0.79,0.54,CHANDLER REGIONAL MEDICAL CENTER
7.36,2.70,33.45154,-112.04313,28242.62,7162.08,0.50,0.47,0.64,ST LUKES MEDICAL CENTER
7.09,2.33,33.48885,-111.92387,27030.96,5460.62,0.67,0.76,0.54,SCOTTSDALE HEALTHCARE-OSBORN MEDICAL CENTER
4.70,2.57,31.55116,-110.27248,16211.42,6563.25,0.00,0.00,0.00,SIERRA VISTA REGIONAL HEALTH CENTER INC
6.13,2.44,35.22024,-114.03585,22678.55,5958.70,0.67,0.66,0.54,KINGMAN REGIONAL MEDICAL CENTER
7.43,2.27,33.60432,-112.28378,28557.11,5188.57,0.83,0.75,0.96,BANNER BOSWELL MEDICAL CENTER
6.80,3.17,32.24152,-110.94631,25710.12,9291.00,0.50,0.38,0.39,UNIVERSITY OF ARIZONA MEDICAL CTR-UNIVERSIT THE
5.77,2.31,33.39097,-111.87638,21042.08,5365.20,0.67,0.80,0.57,BANNER DESERT MEDICAL CENTER
6.83,2.25,32.32103,-111.01102,25840.28,5119.72,0.50,0.71,0.20,NORTHWEST MEDICAL CENTER
6.15,2.31,33.41128,-111.68916,22739.15,5374.04,0.50,0.70,0.64,BANNER BAYWOOD MEDICAL CENTER
6.37,2.35,33.60949,-112.18129,23752.52,5548.68,0.67,0.74,0.76,BANNER THUNDERBIRD MEDICAL CENTER
6.97,2.28,33.65965,-112.37283,26456.52,5220.14,0.50,0.78,0.97,BANNER DEL E WEBB MEDICAL CENTER
11.79,2.35,35.11068,-114.55505,48263.68,5553.00,0.50,0.88,0.64,WESTERN ARIZONA REGIONAL MEDICAL CTR
4.66,2.61,33.65947,-111.95626,16018.33,6717.08,0.67,0.54,0.96,MAYO CLINIC HOSPITAL
5.29,2.42,33.46202,-112.35299,18866.50,5875.00,0.75,0.65,0.69,WEST VALLEY HOSPITAL
6.48,2.53,33.47818,-112.25744,24232.59,6368.68,0.50,0.59,0.70,BANNER ESTRELLA MEDICAL CENTER
5.82,2.45,33.38269,-111.72100,21267.18,6032.55,0.50,0.70,0.58,BANNER GATEWAY MEDICAL CENTER
4.96,2.18,36.10940,-94.16036,17385.38,4804.90,0.33,0.78,0.74,WASHINGTON REGIONAL MED CTR AT NORTH HILLS
4.87,2.19,34.75031,-92.33897,16958.71,4843.35,0.67,0.64,0.83,ST VINCENT INFIRMARY MEDICAL CENTER
3.90,2.10,36.31007,-94.18471,12554.50,4422.29,0.50,0.68,0.45,MERCY MEDICAL CENTER
4.46,2.19,35.25046,-91.70056,15118.02,4821.10,0.50,0.61,0.64,WHITE COUNTY MEDICAL CENTER
3.81,2.51,34.74866,-92.35422,12172.52,6294.29,0.50,0.51,0.33,UAMS MEDICAL CENTER
2.64,2.26,35.83746,-90.70386,6886.29,5129.67,0.50,0.75,0.03,ST BERNARDS MEDICAL CTR
5.13,2.15,36.18082,-94.13644,18160.87,4642.55,0.50,0.69,0.30,NW ARKANSAS HOSPITALS LLC
5.62,2.18,34.46784,-93.06667,20362.57,4767.75,0.67,0.66,0.86,ST JOSEPHS MERCY HEALTH CENTER INC
2.98,2.06,36.34295,-92.39442,8388.65,4244.22,0.50,0.65,0.58,BAXTER REGIONAL MEDICAL CENTER
3.60,2.14,35.08546,-92.45774,11235.45,4587.55,0.50,0.72,0.80,CONWAY REGIONAL MEDICAL CENTER
5.10,2.10,34.77770,-92.12539,18003.86,4422.57,0.50,0.60,0.14,BAPTIST HEALTH MEDICAL CENTER NORTH LITTLE ROCK
4.90,2.20,35.28275,-93.14901,17098.17,4880.78,0.00,0.00,0.00,ST MARYS REGIONAL MEDICAL CENTER
4.62,2.42,35.14320,-90.18837,15822.69,5895.15,0.00,0.00,0.00,CRITTENDEN MEMORIAL HOSPITAL
3.37,2.15,35.37445,-94.41868,10171.46,4659.65,0.50,0.54,0.86,SPARKS REGIONAL MEDICAL CENTER
6.16,2.09,35.35395,-94.35262,22816.06,4388.28,0.50,0.66,0.11,ST EDWARD MERCY MEDICAL CENTER
5.54,2.28,34.18894,-92.01886,20017.81,5239.62,0.50,0.75,0.05,JEFFERSON REGIONAL MEDICAL CENTER
3.49,2.19,34.35877,-92.78638,10730.17,4857.42,0.00,0.00,0.00,HOT SPRING COUNTY MEDICAL CENTER
7.33,2.18,34.48600,-93.03521,28093.82,4795.73,0.50,0.51,0.08,NATIONAL PARK MEDICAL CENTER
3.90,2.12,34.57290,-92.58508,12586.80,4523.93,0.50,0.89,0.72,SALINE MEMORIAL HOSPITAL
4.82,2.20,33.22053,-92.67102,16756.88,4878.41,0.50,0.70,0.14,MEDICAL CENTER SOUTH ARKANSAS
4.33,2.13,34.74866,-92.35422,14523.64,4566.27,0.50,0.44,0.21,BAPTIST HEALTH MEDICAL CENTER-LITTLE ROCK
3.64,2.21,35.80838,-90.66658,11384.58,4946.92,0.50,0.57,0.70,NEA BAPTIST MEMORIAL HOSPITAL
5.43,2.26,35.76927,-91.63408,19480.56,5133.75,0.33,0.64,0.38,WHITE RIVER MEDICAL CENTER
10.45,3.10,37.63362,-122.08802,42212.75,8965.92,0.50,0.60,0.07,ST ROSE HOSPITAL
9.80,2.54,37.59283,-122.38249,39256.75,6412.00,0.50,0.71,0.33,PENINSULA MEDICAL CENTER
7.69,2.67,38.57053,-121.45216,29703.25,6998.67,0.83,0.54,0.28,MERCY GENERAL HOSPITAL
9.09,2.76,33.97659,-117.38184,36072.00,7418.00,0.50,0.65,0.58,RIVERSIDE COMMUNITY HOSPITAL
8.18,2.96,32.68425,-117.08161,31933.00,8301.12,0.00,0.00,0.00,PARADISE VALLEY HOSPITAL
6.12,3.14,32.75426,-117.16592,22614.32,9117.00,0.50,0.72,0.70,UNIVERSITY OF CALIFORNIA SAN DIEGO MEDICAL CENTER
7.68,2.44,32.77495,-117.01467,29673.19,5961.19,0.83,0.71,0.33,GROSSMONT HOSPITAL
7.39,2.50,39.50528,-121.54100,28359.56,6249.07,0.50,0.74,0.64,OROVILLE HOSPITAL
10.73,2.53,35.38736,-119.01690,43483.94,6364.91,0.33,0.85,0.80,BAKERSFIELD MEMORIAL HOSPITAL
9.84,3.91,37.31288,-121.93329,39442.33,12598.67,0.67,0.65,0.02,SANTA CLARA VALLEY MEDICAL CENTER
6.29,2.34,39.74221,-121.85000,23396.13,5529.73,0.83,0.71,0.48,ENLOE MEDICAL CENTER
10.44,4.56,34.30238,-118.36957,42167.21,15566.14,0.50,0.90,0.29,LAC/OLIVE VIEW-UCLA MEDICAL CENTER
10.60,3.02,37.82206,-122.26275,42876.11,8587.05,0.50,0.64,0.32,ALTA BATES SUMMIT MEDICAL CENTER
10.00,2.63,32.78037,-115.56848,40174.64,6822.18,0.50,0.97,0.70,EL CENTRO REGIONAL MEDICAL CENTER
12.81,3.30,37.79100,-122.43125,52910.07,9865.20,0.83,0.64,0.11,CALIFORNIA PACIFIC MEDICAL CTR-PACIFIC CAMPUS HOSP
11.06,3.12,37.74717,-122.42088,44985.00,9043.86,0.50,0.59,0.30,CALIFORNIA PACIFIC MEDICAL CTR - ST. LUKE'S CAMPUS
5.92,2.64,34.67486,-118.15771,21694.29,6890.58,0.50,0.68,0.45,ANTELOPE VALLEY HOSPITAL MED CENTER
8.93,2.54,36.32737,-119.29548,35352.95,6398.19,0.50,0.56,0.12,KAWEAH DELTA MEDICAL CENTER
7.12,2.91,34.12834,-118.25777,27160.71,8072.71,0.50,0.72,0.45,GLENDALE MEM HOSPITAL & HLTH CENTER
6.99,2.88,36.73000,-119.78000,26541.78,7942.04,0.50,0.71,0.00,COMMUNITY REGIONAL MEDICAL CENTER
6.70,3.18,34.09643,-118.29103,25230.81,9306.00,0.75,0.76,0.74,HOLLYWOOD PRESBYTERIAN MEDICAL CENTER
10.12,2.37,33.78036,-117.86495,40719.06,5648.83,0.50,0.60,0.89,ST JOSEPH HOSPITAL
8.40,2.75,32.75143,-117.16083,32918.63,7385.95,0.33,0.62,0.70,SCRIPPS MERCY HOSPITAL
7.35,2.47,33.73798,-118.30525,28171.67,6118.92,0.50,0.81,0.82,PROVIDENCE LITTLE CO OF MARY MED CTR SAN PEDRO
12.25,2.85,37.95337,-122.33672,50379.24,7831.48,0.50,0.64,0.19,DOCTORS MEDICAL CENTER-SAN PABLO
7.53,2.54,34.21674,-119.15631,29018.47,6412.77,0.50,0.64,0.07,ST JOHNS REGIONAL MEDICAL CENTER
11.57,2.64,37.96987,-121.28873,47266.18,6865.86,0.83,0.69,0.97,ST JOSEPHS MED CENTER OF STOCKTON
10.07,2.97,34.13101,-117.32181,40499.21,8353.00,0.50,0.84,0.47,COMMUNITY HOSPITAL OF SAN BERNARDINO
6.40,2.53,36.83532,-119.76562,23867.73,6378.58,0.50,0.66,0.58,SAINT AGNES MEDICAL CENTER
6.45,2.37,34.10130,-117.63651,24127.00,5660.85,0.50,0.66,0.86,SAN ANTONIO COMMUNITY HOSPITAL
10.86,2.54,32.79949,-117.15394,44076.85,6413.85,0.67,0.62,0.11,SHARP MEMORIAL HOSPITAL
11.13,2.91,38.13118,-122.23732,45309.00,8103.62,0.50,0.81,0.29,SUTTER SOLANO MEDICAL CENTER
10.97,3.11,34.04932,-118.21746,44574.43,9019.07,0.25,0.74,0.99,WHITE MEMORIAL MEDICAL CENTER
7.75,3.14,33.92963,-118.20332,30006.73,9116.64,0.67,0.79,0.33,SAINT FRANCIS MEDICAL CENTER
5.72,2.52,34.95099,-120.41322,20794.31,6332.38,0.50,0.94,0.48,MARIAN MEDICAL CENTER
8.82,2.69,38.57155,-121.46874,34846.22,7103.67,0.83,0.78,0.80,SUTTER GENERAL HOSPITAL
7.92,2.81,34.07558,-118.28424,30777.07,7641.00,0.00,0.00,0.00,TEMPLE COMMUNITY HOSPITAL
10.30,2.58,34.02685,-118.48651,41550.88,6618.76,0.50,0.76,0.21,SANTA MONICA - UCLA MED CTR & ORTHOPAEDIC HOSPITAL
9.89,2.42,33.12535,-117.07336,39668.57,5880.00,0.50,0.55,0.70,PALOMAR MEDICAL CENTER
9.93,2.57,34.22014,-118.53410,39858.89,6566.00,0.33,0.56,0.45,NORTHRIDGE HOSPITAL MEDICAL CENTER
5.70,2.68,36.32362,-119.66726,20740.57,7074.20,0.50,0.89,0.25,ADVENTIST MEDICAL CENTER
14.47,2.56,37.96125,-121.30103,60396.14,6517.29,0.50,0.49,0.10,DAMERON HOSPITAL
14.83,3.24,37.36257,-121.84974,62051.84,9580.35,0.50,0.70,0.02,REGIONAL MEDICAL CENTER OF SAN JOSE
5.91,2.47,33.18402,-117.29661,21656.95,6087.77,0.50,0.57,0.21,TRI-CITY MEDICAL CENTER
10.15,2.64,34.13495,-117.27603,40843.42,6868.50,0.50,0.66,0.48,ST BERNARDINE MEDICAL CENTER
12.90,2.80,34.10081,-118.10588,53293.12,7577.82,0.00,0.00,0.00,SAN GABRIEL VALLEY MEDICAL CENTER
7.33,2.48,39.13822,-121.59436,28112.07,6130.15,0.50,0.51,0.21,RIDEOUT MEMORIAL HOSPITAL
5.91,2.94,34.09638,-118.32518,21650.40,8216.67,0.00,0.00,0.00,HOLLYWOOD COMMUNITY HOSPITAL OF HOLLYWOOD
12.38,3.06,36.57886,-121.91316,50954.12,8790.00,0.67,0.56,0.58,COMMUNITY HOSPITAL OF THE MONTEREY PENINSULA
6.52,3.07,34.03705,-118.26575,24409.00,8825.68,0.33,0.88,0.89,CALIFORNIA HOSPITAL MEDICAL CENTER LA
10.12,2.63,39.22809,-121.04721,40710.08,6841.54,0.00,0.00,0.00,SIERRA NEVADA MEMORIAL HOSPITAL
13.06,3.05,37.78963,-122.41700,54034.75,8745.33,0.75,0.70,0.30,SAINT FRANCIS MEMORIAL HOSPITAL
6.72,3.02,34.28029,-119.25410,25336.85,8609.23,0.50,0.49,0.03,VENTURA COUNTY MEDICAL CENTER
8.54,3.12,37.88664,-121.28308,33593.94,9035.44,0.50,0.89,0.83,SAN JOAQUIN GENERAL HOSPITAL
10.60,2.24,33.89465,-117.92716,42907.53,5060.47,0.67,0.71,0.91,ST JUDE MEDICAL CENTER
11.45,2.40,33.96860,-118.04831,46725.56,5803.94,0.50,0.46,0.16,PRESBYTERIAN INTERCOMMUNITY HOSPITAL
10.58,2.70,38.44369,-122.70138,42787.93,7162.33,0.67,0.86,0.58,SANTA ROSA MEMORIAL HOSPITAL
11.08,2.48,37.51164,-120.83800,45068.08,6129.33,0.33,0.86,0.16,EMANUEL MEDICAL CENTER INC
14.20,2.71,37.91341,-122.04163,59192.67,7194.95,0.50,0.62,0.33,JOHN MUIR MEDICAL CENTER - WALNUT CREEK CAMPUS
7.95,2.92,33.77991,-118.18602,30915.00,8130.23,0.50,0.82,0.94,ST MARY MEDICAL CENTER
16.33,3.05,36.92821,-121.79360,68804.15,8747.85,0.00,0.00,0.00,WATSONVILLE COMMUNITY HOSPITAL
14.17,2.89,37.55717,-121.98126,59048.96,8020.26,0.50,0.54,0.89,WASHINGTON HOSPITAL
14.25,2.59,37.48000,-122.25441,59399.64,6646.91,0.00,0.00,0.00,SEQUOIA HOSPITAL
9.31,2.41,34.58305,-118.14490,37078.83,5848.58,0.50,0.86,0.54,PALMDALE REGIONAL MEDICAL CENTER
4.68,2.71,33.91255,-118.09846,16095.38,7201.77,0.00,0.00,0.00,COAST PLAZA HOSPITAL
12.27,2.63,32.61972,-117.02278,50431.91,6833.55,0.50,0.71,0.58,SHARP CHULA VISTA MEDICAL CENTER
6.60,2.22,33.62229,-117.92995,24796.38,4968.57,0.50,0.70,0.51,HOAG MEMORIAL HOSPITAL PRESBYTERIAN
10.41,2.45,33.84780,-117.93661,42022.88,6033.25,0.50,0.74,0.58,AHMC ANAHEIM REGIONAL MEDICAL CENTER
19.90,5.43,37.75676,-122.40461,85003.78,19511.96,0.75,0.51,0.12,SAN FRANCISCO GENERAL HOSPITAL
7.70,3.05,33.77483,-117.91329,29761.83,8725.92,0.50,0.85,0.98,GARDEN GROVE HOSPITAL & MEDICAL CENTER
10.63,2.84,34.07709,-117.75063,43041.07,7779.13,0.33,0.74,0.98,POMONA VALLEY HOSPITAL MEDICAL CENTER
11.39,2.45,34.15601,-118.32834,46469.30,6016.45,0.50,0.80,0.97,PROVIDENCE SAINT JOSEPH MEDICAL CTR
8.97,2.37,34.28920,-118.74484,35503.55,5628.00,0.50,0.90,0.93,SIMI VALLEY HOSPITAL & HEALTH CARE SERVICES
7.42,2.50,34.13973,-118.03534,28506.96,6233.14,0.50,0.45,0.11,METHODIST HOSPITAL OF SOUTHERN CA
10.93,2.89,34.14987,-118.23117,44378.84,8004.04,0.67,0.75,0.89,GLENDALE ADVENTIST MEDICAL CENTER
14.34,3.32,36.98999,-121.98357,59826.71,9931.94,0.50,0.64,0.64,DOMINICAN HOSPITAL
5.23,3.18,34.07389,-117.35111,18614.81,9326.31,0.33,0.81,0.07,ARROWHEAD REGIONAL MEDICAL CENTER
6.75,2.63,36.06956,-119.02748,25474.41,6845.50,0.00,0.00,0.00,SIERRA VIEW DISTRICT HOSPITAL
11.17,3.75,34.06675,-118.44613,45486.82,11883.12,0.50,0.28,0.33,RONALD REAGAN UCLA MEDICAL CENTER
8.62,4.60,38.00655,-122.13312,33939.25,15731.08,0.50,0.66,0.28,CONTRA COSTA REGIONAL MEDICAL CENTER
7.84,2.97,33.80733,-118.19305,30393.44,8377.50,0.00,0.00,0.00,PACIFIC HOSPITAL OF LONG BEACH
16.80,2.55,34.27915,-118.46006,70932.58,6480.74,0.50,0.80,0.25,PROVIDENCE HOLY CROSS MEDICAL CENTER
8.81,2.66,40.58654,-122.39168,34806.81,6952.95,0.83,0.71,0.45,MERCY MEDICAL CENTER REDDING
8.29,2.84,34.09049,-118.14410,32463.50,7773.94,0.50,1.00,0.98,ALHAMBRA HOSPITAL MEDICAL CENTER
12.95,2.79,37.67947,-122.47447,53528.58,7531.00,0.50,0.62,0.25,SETON MEDICAL CENTER
6.96,2.21,34.03009,-118.47833,26419.07,4912.60,0.50,0.81,0.76,SAINT JOHN'S HEALTH CENTER
9.12,2.86,33.91173,-117.19590,36218.43,7868.71,0.50,0.78,0.52,RIVERSIDE COUNTY REGIONAL MEDICAL CENTER
8.27,2.38,35.37279,-119.02817,32359.57,5694.00,0.50,0.70,0.83,MERCY HOSPITAL
7.75,2.49,34.50107,-117.17285,29994.26,6182.63,0.50,0.88,0.20,ST MARY MEDICAL CENTER
7.26,3.04,37.85593,-122.25730,27763.23,8662.08,0.50,0.56,0.08,ALTA BATES SUMMIT MEDICAL CENTER - ALTA BATES CAMP
12.57,2.55,37.36934,-122.08047,51825.58,6462.58,0.67,0.49,0.07,EL CAMINO HOSPITAL
7.05,2.44,38.76514,-121.24979,26819.14,5978.48,0.67,0.78,0.16,SUTTER ROSEVILLE MEDICAL CENTER
9.81,2.46,37.74409,-121.43469,39335.45,6066.00,0.00,0.00,0.00,SUTTER TRACY COMMUNITY HOSPITAL
8.28,2.28,32.88461,-117.22244,32403.00,5239.00,0.50,0.64,0.30,SCRIPPS MEMORIAL HOSPITAL LA JOLLA
8.13,3.16,34.05076,-117.26395,31707.59,9233.35,0.50,0.55,0.16,LOMA LINDA UNIVERSITY MEDICAL CENTER
6.60,2.53,33.87236,-117.56809,24804.42,6367.58,0.50,0.79,0.82,CORONA REGIONAL MEDICAL CENTER
9.03,2.76,36.65910,-121.64630,35770.19,7426.38,0.50,0.70,0.38,SALINAS VALLEY MEMORIAL HOSPITAL
17.05,2.49,38.12186,-121.28665,72062.44,6214.17,1.00,0.70,0.94,LODI MEMORIAL HOSPITAL
8.13,2.64,32.95813,-115.55388,31739.00,6853.42,0.50,0.91,0.93,PIONEERS MEMORIAL HEALTHCARE DISTRICT
11.16,3.18,33.78798,-117.89026,45424.75,9309.15,0.67,0.56,0.11,UNIVERSITY OF CALIFORNIA IRVINE MED CENTER
3.90,2.73,34.01501,-118.10064,12555.88,7257.00,0.50,0.89,0.74,BEVERLY HOSPITAL
10.64,2.36,33.81131,-118.34364,43055.30,5584.17,0.67,0.68,0.89,TORRANCE MEMORIAL MEDICAL CENTER
11.86,2.45,33.83891,-118.35677,48607.60,6027.20,0.50,0.86,0.94,PROVIDENCE LITTLE COMPANY OF MARY MED CTR TORRANCE
4.62,2.63,36.22008,-119.33764,15840.46,6829.00,0.00,0.00,0.00,TULARE REGIONAL MEDICAL CENTER
13.08,2.65,37.94748,-122.53677,54140.55,6914.09,0.50,0.64,0.16,MARIN GENERAL HOSPITAL
19.86,2.98,38.26174,-122.04662,84822.36,8404.09,0.50,0.69,0.30,NORTHBAY MEDICAL CENTER
9.38,3.72,34.06034,-118.21014,37359.94,11780.81,0.67,0.70,0.03,LAC+USC MEDICAL CENTER
4.31,3.03,34.24018,-118.39632,14431.83,8623.25,0.00,0.00,0.00,PACIFICA HOSPITAL OF THE VALLEY
6.85,2.87,34.08802,-117.89341,25935.00,7910.62,0.67,0.68,0.29,CITRUS VALLEY MEDICAL CENTER-IC CAMPUS
6.19,2.43,33.75117,-116.96028,22934.08,5934.33,0.50,0.74,0.83,HEMET VALLEY MEDICAL CENTER
11.88,2.67,33.93530,-118.13030,48668.43,7020.23,0.50,0.90,0.83,DOWNEY REGIONAL MEDICAL CENTER
10.66,2.52,34.42951,-119.72333,43182.79,6313.58,0.67,0.72,0.32,SANTA BARBARA COTTAGE HOSPITAL
4.32,2.65,33.82557,-117.99493,14486.82,6903.18,0.50,0.91,0.98,WEST ANAHEIM MEDICAL CENTER
10.94,2.52,34.13364,-118.15275,44413.38,6323.03,0.67,0.65,0.58,HUNTINGTON MEMORIAL HOSPITAL
17.56,3.95,37.43436,-122.18013,74384.19,12793.38,0.50,0.59,0.28,STANFORD HOSPITAL
7.87,2.75,37.34027,-120.46817,30525.95,7378.68,0.50,0.78,0.38,MERCY MEDICAL CENTER
10.69,3.57,37.76421,-122.45716,43288.55,11102.45,0.67,0.53,0.91,UCSF MEDICAL CENTER
6.64,2.54,35.38338,-119.01969,24979.29,6408.93,0.33,0.86,0.07,SAN JOAQUIN COMMUNITY HOSPITAL
17.26,2.69,37.66540,-120.99743,73030.80,7088.80,0.67,0.66,0.10,DOCTORS MEDICAL CENTER
6.14,2.78,33.89307,-118.29506,22691.75,7515.25,0.50,0.96,0.99,MEMORIAL HOSPITAL OF GARDENA
8.22,2.85,34.05336,-118.26558,32107.84,7822.34,0.50,0.69,0.80,GOOD SAMARITAN HOSPITAL
8.92,2.63,33.80861,-118.18661,35289.72,6848.91,0.67,0.65,0.28,LONG BEACH MEMORIAL MEDICAL CENTER
9.18,2.77,37.69824,-122.08730,36455.32,7464.61,0.67,0.61,0.54,EDEN MEDICAL CENTER
17.29,2.64,37.98396,-122.03464,73174.81,6867.58,0.50,0.76,0.98,JOHN MUIR MEDICAL CENTER - CONCORD CAMPUS
9.19,3.01,34.06389,-118.27347,36505.40,8562.95,0.50,0.80,0.99,SAINT VINCENT MEDICAL CENTER
10.04,2.97,38.66956,-121.31378,40343.03,8376.59,0.67,0.66,0.30,MERCY SAN JUAN MEDICAL CENTER
7.85,3.10,37.98224,-121.80362,30437.00,8932.21,0.50,0.59,0.25,SUTTER DELTA MEDICAL CENTER
6.36,2.48,33.70376,-117.98776,23719.08,6169.23,0.00,0.00,0.00,HUNTINGTON BEACH HOSPITAL
11.34,2.82,33.68179,-116.23394,46260.17,7678.67,0.50,0.70,0.16,JOHN F KENNEDY MEMORIAL HOSPITAL INC
11.64,2.53,34.20777,-118.88305,47619.53,6389.00,0.50,0.51,0.70,LOS ROBLES HOSPITAL & MEDICAL CENTER
11.19,2.48,37.66867,-120.97339,45564.69,6156.10,0.67,0.80,0.54,MEMORIAL  MEDICAL CENTER
9.87,2.34,33.56100,-117.66530,39613.69,5510.92,0.67,0.59,0.13,MISSION HOSPITAL REGIONAL MED CENTER
10.31,2.75,33.71466,-117.93322,41581.92,7351.56,0.50,0.86,0.33,FOUNTAIN VALLEY REGIONAL HOSPITAL & MEDICAL CENTER
13.55,2.28,33.76335,-116.40628,56262.18,5237.00,0.50,0.56,0.39,EISENHOWER MEDICAL CENTER
6.66,2.61,33.83340,-118.08118,25054.24,6754.00,0.50,0.90,0.99,TRI-CITY REGIONAL MEDICAL CENTER
5.52,2.65,33.84753,-118.03841,19912.89,6916.95,0.00,0.00,0.00,LA PALMA INTERCOMMUNITY HOSPITAL
10.90,2.46,33.84932,-118.15323,44246.86,6050.14,0.83,0.80,0.13,LAKEWOOD REGIONAL MEDICAL CENTER
4.80,2.57,34.02561,-117.68583,16632.09,6548.73,0.00,0.00,0.00,CHINO VALLEY MEDICAL CENTER
8.05,2.80,38.46387,-121.41645,31359.22,7579.87,0.50,0.60,0.58,METHODIST HOSPITAL OF SACRAMENTO
6.22,2.49,34.13289,-117.87121,23060.17,6198.61,0.50,0.82,0.96,FOOTHILL PRESBYTERIAN HOSPITAL
12.47,3.36,38.55484,-121.45628,51350.41,10143.90,0.50,0.50,0.03,UNIVERSITY OF CALIFORNIA DAVIS MEDICAL CENTER
8.79,2.40,33.60883,-117.70881,34712.68,5763.63,0.50,0.70,0.91,SADDLEBACK MEMORIAL MEDICAL CENTER
7.22,2.90,35.76216,-119.23889,27608.56,8063.25,0.00,0.00,0.00,DELANO REGIONAL MEDICAL CENTER
16.81,2.83,34.07664,-118.37955,71006.05,7752.88,1.00,0.59,0.48,CEDARS-SINAI MEDICAL CENTER
15.20,2.36,35.55536,-120.72067,63705.65,5601.53,0.00,0.00,0.00,TWIN CITIES COMMUNITY HOSPITAL
5.26,2.97,34.01936,-118.18661,18743.00,8382.44,0.50,0.90,0.64,LOS ANGELES COMMUNITY HOSPITAL
7.27,2.36,33.70167,-117.95566,27823.85,5586.08,0.50,0.82,0.89,ORANGE COAST MEMORIAL MEDICAL CENTER
12.30,2.86,37.03560,-121.57109,50610.71,7863.00,0.50,0.91,0.03,SAINT LOUISE REGIONAL HOSPITAL
6.06,2.40,33.55876,-117.18329,22343.45,5789.91,0.67,0.74,0.74,SOUTHWEST HEALTHCARE SYSTEM
5.26,2.85,34.22139,-118.45660,18709.75,7809.08,0.00,0.00,0.00,MISSION COMMUNITY HOSPITAL - PANORAMA
4.71,2.36,34.47174,-117.29791,16238.44,5620.67,0.50,1.00,0.99,DESERT VALLEY HOSPITAL
14.79,3.06,34.06760,-118.12291,61852.14,8785.75,0.50,0.94,0.86,GARFIELD MEDICAL CENTER
8.26,2.98,34.04777,-118.04344,32302.56,8403.50,0.00,0.00,0.00,GREATER EL MONTE COMMUNITY HOSPITAL
9.07,2.67,33.95076,-118.34828,35988.81,7012.43,0.50,0.71,1.00,CENTINELA HOSPITAL MEDICAL CENTER
16.81,2.48,34.05723,-118.36025,70976.58,6152.62,0.50,0.64,0.70,OLYMPIA MEDICAL CENTER
11.93,2.52,34.02303,-118.39741,48935.50,6337.20,0.00,0.00,0.00,BROTMAN MEDICAL CENTER
5.88,2.80,34.07861,-117.69582,21522.47,7580.00,0.00,0.00,0.00,MONTCLAIR HOSPITAL MEDICAL CENTER
17.88,2.51,34.17067,-118.53200,75860.18,6276.94,0.50,0.57,0.64,PROVIDENCE TARZANA MEDICAL CENTER
5.09,3.04,34.06958,-118.26344,17944.16,8661.68,0.00,0.00,0.00,SILVER LAKE MEDICAL CENTER
8.76,2.53,40.58532,-122.38702,34565.61,6381.72,0.50,0.79,0.98,SHASTA REGIONAL MEDICAL CENTER
4.68,2.42,40.41481,-104.70890,16122.15,5857.55,0.50,0.74,0.58,NORTH COLORADO MEDICAL CENTER
6.35,2.17,39.76893,-105.09006,23682.16,4749.20,0.50,0.47,0.80,EXEMPLA LUTHERAN MEDICAL CENTER
4.50,2.15,40.57315,-105.05741,15296.77,4648.08,0.50,0.69,0.96,POUDRE VALLEY HOSPITAL
4.52,2.98,39.72730,-104.99157,15378.79,8410.42,0.67,0.66,0.14,DENVER HEALTH MEDICAL CENTER
5.62,2.29,38.23421,-104.62292,20367.46,5286.61,0.50,0.54,0.30,CENTURA HEALTH-ST MARY CORWIN MEDICAL CENTER
6.06,2.25,38.28184,-104.61256,22361.88,5109.84,0.67,0.69,0.30,PARKVIEW MEDICAL CENTER INC
5.86,2.26,38.83903,-104.80024,21435.58,5150.63,0.67,0.69,0.33,MEMORIAL HOSPITAL CENTRAL
5.68,2.37,39.09046,-108.56190,20638.00,5635.78,0.50,0.49,0.58,ST MARYS HOSPITAL AND MEDICAL CENTER
5.58,3.00,39.74234,-104.84156,20190.91,8497.65,0.67,0.66,0.70,UNIVERSITY OF COLORADO HOSPITAL ANSCHUTZ INPATIENT
4.34,2.14,40.41320,-105.05139,14548.64,4592.09,0.50,0.93,0.70,MCKEE MEDICAL CENTER
5.40,2.22,38.86559,-104.82182,19360.46,4968.15,0.50,0.70,0.38,CENTURA HEALTH-PENROSE ST FRANCIS HEALTH SERVICES
7.43,2.36,39.65399,-104.98116,28553.76,5622.82,0.33,0.47,0.17,SWEDISH MEDICAL CENTER
9.40,2.35,39.86430,-104.98481,37453.73,5551.91,0.50,0.84,0.01,NORTH SUBURBAN MEDICAL CENTER
7.23,2.34,39.84960,-105.01825,27642.29,5519.86,0.50,0.61,0.48,CENTURA HEALTH-ST ANTHONY NORTH HOSPITAL
5.75,2.13,40.45184,-105.19608,20932.92,4545.00,0.50,0.79,0.45,MEDICAL CENTER OF THE ROCKIES
5.37,2.55,41.30978,-72.93806,19234.56,6468.09,0.67,0.57,0.08,HOSPITAL OF ST RAPHAEL
5.51,2.62,41.77507,-72.69941,19842.98,6790.02,0.50,0.54,0.86,ST FRANCIS HOSPITAL & MEDICAL CENTER
7.42,2.57,41.55959,-73.05941,28488.36,6577.50,0.33,0.57,0.70,WATERBURY HOSPITAL
7.21,2.54,41.05562,-73.55390,27537.70,6436.41,0.50,0.53,0.11,STAMFORD HOSPITAL
3.92,2.39,41.33722,-72.10380,12662.42,5750.94,0.50,0.72,0.93,LAWRENCE & MEMORIAL HOSPITAL
5.43,2.92,41.18881,-73.16645,19496.41,8119.27,0.50,0.51,0.21,BRIDGEPORT HOSPITAL
2.81,2.32,41.79153,-73.13382,7653.20,5412.33,0.25,0.79,0.54,CHARLOTTE HUNGERFORD HOSPITAL
3.39,2.62,41.55241,-73.03554,10261.73,6787.20,0.50,0.56,0.39,SAINT MARYS HOSPITAL
4.24,2.38,41.54874,-72.80148,14133.43,5683.71,0.50,0.60,0.80,MIDSTATE MEDICAL CENTER
6.20,2.41,41.03431,-73.63020,22997.64,5830.00,0.50,0.49,0.64,GREENWICH HOSPITAL ASSOCIATION
5.76,2.39,41.55473,-72.64872,20981.12,5736.27,0.33,0.61,0.93,MIDDLESEX HOSPITAL
7.32,3.14,41.30400,-72.93502,28055.49,9135.01,0.67,0.41,0.03,YALE-NEW HAVEN HOSPITAL
